Name,image-link,Quantity,Price,Description,Subtext
Infinity Stones,static/images/infinitystones.webp,2000,200,Stores everthing that you need including bodies :),
The Honored One,static/images/satoru_gojo_death_by_fleetadmiraljay_dgao8ln-fullview.jpg,300,210,Nah I'd Win, - said the man above
Trident of Poseidon,static/images/posiden_trident.jpg,20,150,This is used to control the oceans,
Now I am become Death,static/images/nukecore.jpg,200,1000, We do ship to Iran and Iraq,
The Other Honored One,static/images/nedsdead-cropped.avif,1,10, Valar Morghulis,
My Precious,static/images/One_Ring_Blender_Render.png,1, 50, The one Ring,